{
  "title": "Case #1: The Detective's Inquiry (3x3 Easy)",
  "grid_size": 3,
  "characters": [
    { "id": "A1", "name": "Alice", "job": "Detective", "row": 1, "col": 1, "true_status": "INNOCENT" },
    { "id": "B1", "name": "Bob", "job": "Officer", "row": 1, "col": 2, "true_status": "CRIMINAL" },
    { "id": "C1", "name": "Charlie", "job": "Journalist", "row": 1, "col": 3, "true_status": "INNOCENT" },
    { "id": "A2", "name": "David", "job": "Chef", "row": 2, "col": 1, "true_status": "CRIMINAL" },
    { "id": "B2", "name": "Eve", "job": "Doctor", "row": 2, "col": 2, "true_status": "INNOCENT" },
    { "id": "C2", "name": "Frank", "job": "Lawyer", "row": 2, "col": 3, "true_status": "CRIMINAL" },
    { "id": "A3", "name": "Grace", "job": "Artist", "row": 3, "col": 1, "true_status": "INNOCENT" },
    { "id": "B3", "name": "Heidi", "job": "Pilot", "row": 3, "col": 2, "true_status": "CRIMINAL" },
    { "id": "C3", "name": "Ivan", "job": "Engineer", "row": 3, "col": 3, "true_status": "INNOCENT" }
  ],
  "clues": [
    {
      "id": "c1",
      "type": "FACT",
      "params": { "person": "A1", "status": "INNOCENT" },
      "description": "Alice (A1) is verified INNOCENT.",
      "owner_id": "A1",
      "is_initially_revealed": true
    },
    {
      "id": "c2",
      "type": "SAME",
      "params": { "person1": "A1", "person2": "C1" },
      "description": "Alice (A1) and Charlie (C1) have the SAME status.",
      "owner_id": "A1",
      "is_initially_revealed": true
    },
    {
      "id": "c3",
      "type": "DIFFERENT",
      "params": { "person1": "A1", "person2": "B1" },
      "description": "Alice (A1) and Bob (B1) have DIFFERENT statuses.",
      "owner_id": "C1",
      "is_initially_revealed": false
    },
    {
      "id": "c4",
      "type": "FACT",
      "params": { "person": "B2", "status": "INNOCENT" },
      "description": "Eve (B2) is verified INNOCENT.",
      "owner_id": "B1",
      "is_initially_revealed": false
    },
    {
      "id": "c5",
      "type": "EXACTLY",
      "params": { "k": 2, "region": { "type": "ROW", "param": 2 } },
      "description": "Exactly 2 characters in Row 2 are CRIMINAL.",
      "owner_id": "B2",
      "is_initially_revealed": false
    },
    {
      "id": "c6",
      "type": "SAME",
      "params": { "person1": "A2", "person2": "C2" },
      "description": "David (A2) and Frank (C2) have the SAME status.",
      "owner_id": "A2",
      "is_initially_revealed": false
    },
    {
      "id": "c7",
      "type": "BETWEEN",
      "params": { "char1": "A3", "char2": "C3", "target_status": "CRIMINAL" },
      "description": "Anyone strictly BETWEEN Grace (A3) and Ivan (C3) is CRIMINAL.",
      "owner_id": "C2",
      "is_initially_revealed": false
    },
    {
      "id": "c8",
      "type": "PARITY",
      "params": { "parity_type": "ODD", "region": { "type": "ROW", "param": 3 } },
      "description": "Row 3 has an ODD number of CRIMINALs.",
      "owner_id": "B3",
      "is_initially_revealed": false
    },
    {
      "id": "c9",
      "type": "DIFFERENT",
      "params": { "person1": "B3", "person2": "A3" },
      "description": "Heidi (B3) and Grace (A3) have DIFFERENT statuses.",
      "owner_id": "B3",
      "is_initially_revealed": false
    },
    {
      "id": "c10",
      "type": "SAME",
      "params": { "person1": "A3", "person2": "C3" },
      "description": "Grace (A3) and Ivan (C3) have the SAME status.",
      "owner_id": "A3",
      "is_initially_revealed": false
    }
  ]
}
